{
  "id": "live-ssai",
  "version": "0.2.11",
  "architecture": "ssai",
  "authority": { "id": "provisional", "role": "other" },
  "environments": [
    {
      "id": "live-ssai",
      "architecture": "ssai",
      "event_infrastructure": true
    }
  ],
  "proactive_required": true,
  "unknown_creative_treatment": "informational",
  "transformation_rights": {
    "inherit_on_encode": true,
    "mint_on_media_replacement": true
  },
  "invalidation_rules": [
    {
      "id": "provisional.tracking-only",
      "when": "tracking_only",
      "action": "keep_transcode"
    },
    {
      "id": "provisional.media-change",
      "when": "media_change",
      "action": "invalidate_technical_operational"
    },
    {
      "id": "provisional.wrapper-change",
      "when": "wrapper_change",
      "action": "revaluate_technical"
    },
    {
      "id": "provisional.emergency-pull",
      "when": "emergency_pull",
      "action": "expire"
    }
  ],
  "transcode_ladder": {
    "id": "live-ssai-default",
    "packaging": "mp4",
    "renditions": [
      {
        "name": "720p",
        "width": 1280,
        "height": 720,
        "vcodec": "libx264"
      }
    ]
  },
  "requirements": [
    {
      "id": "live-ssai.vpaid-forbidden",
      "kind": "forbid_vpaid",
      "message": "live-ssai forbids VPAID; the creative is not technically ready for this SSAI path."
    },
    {
      "id": "live-ssai.mezzanine-required",
      "kind": "require_element",
      "element": "Mezzanine",
      "message": "live-ssai requires a Mezzanine for SSAI preparation."
    },
    {
      "id": "live-ssai.universaladid-required",
      "kind": "require_element",
      "element": "UniversalAdId",
      "message": "live-ssai requires UniversalAdId so prepared media can be reused across hops."
    },
    {
      "id": "live-ssai.adservingid-required",
      "kind": "require_element",
      "element": "AdServingId",
      "message": "live-ssai requires AdServingId so the mapped ad can be reused across hops."
    },
    {
      "id": "live-ssai.media-https",
      "kind": "media_https",
      "message": "live-ssai requires HTTPS MediaFile and Mezzanine URLs."
    },
    {
      "id": "live-ssai.max-duration",
      "kind": "max_duration_seconds",
      "max": 60,
      "message": "live-ssai caps Linear duration at 60 seconds for this live path."
    },
    {
      "id": "live-ssai.min-duration",
      "kind": "min_duration_seconds",
      "min": 6,
      "message": "live-ssai requires Linear duration of at least 6 seconds."
    },
    {
      "id": "live-ssai.media-type",
      "kind": "media_type",
      "value": "video/mp4",
      "message": "live-ssai requires a video/mp4 MediaFile."
    },
    {
      "id": "live-ssai.container",
      "kind": "container",
      "value": "mp4",
      "message": "live-ssai requires an mp4 MediaFile container."
    },
    {
      "id": "live-ssai.min-width",
      "kind": "min_width",
      "min": 640,
      "message": "live-ssai requires MediaFile width of at least 640."
    },
    {
      "id": "live-ssai.min-height",
      "kind": "min_height",
      "min": 360,
      "message": "live-ssai requires MediaFile height of at least 360."
    },
    {
      "id": "live-ssai.min-bitrate",
      "kind": "min_bitrate",
      "min": 1000,
      "message": "live-ssai requires a MediaFile bitrate of at least 1000 kbps."
    },
    {
      "id": "live-ssai.max-bitrate",
      "kind": "max_bitrate",
      "max": 20000,
      "message": "live-ssai caps MediaFile bitrate at 20000 kbps."
    },
    {
      "id": "live-ssai.aspect",
      "kind": "aspect_ratio",
      "value": "16:9",
      "message": "live-ssai requires a 16:9 MediaFile."
    },
    {
      "id": "live-ssai.avc",
      "kind": "codec",
      "values": ["avc1", "avc"],
      "message": "live-ssai requires a declared AVC video codec on MediaFile.codecs."
    },
    {
      "id": "live-ssai.aac",
      "kind": "audio_codec",
      "values": ["mp4a", "aac"],
      "message": "live-ssai requires a declared AAC audio codec on MediaFile.codecs."
    },
    {
      "id": "live-ssai.quartile-tracking",
      "kind": "require_tracking_events",
      "values": ["start", "firstQuartile", "midpoint", "thirdQuartile", "complete"],
      "message": "live-ssai requires Linear quartile tracking events."
    },
    {
      "id": "live-ssai.cachebusting",
      "kind": "require_macros",
      "values": ["CACHEBUSTING", "TIMESTAMP"],
      "message": "live-ssai requires CACHEBUSTING and TIMESTAMP macros on a tracking or impression URL."
    }
  ]
}
